{
  "schema_version": "1.0",
  "corpus_version": "viability-corpus-v1",
  "provenance": "Original synthetic Mnemo evaluation data; no production, personal, secret, or competitor content.",
  "templates": [
    {
      "template_id": "software-release",
      "title": "Long-running software implementation and release handoff",
      "category": "software_implementation",
      "realistic": true,
      "challenge_tags": ["early_constraint", "supersession", "negation", "conditional_approval", "failed_approach", "exact_literals", "noise", "multiple_goals", "fresh_session", "drift"],
      "task_prompt": "Resume the Atlas migration, identify the authorized deployment action, and cite the rollback verification command.",
      "horizons": {"short": 15, "medium": 75, "long": 225},
      "events": [
        {"event_key": "sw-goal", "actor": "user", "summary": "goal: Complete the Atlas payment migration with rollback safety.", "position": 0.0},
        {"event_key": "sw-constraint", "actor": "user", "summary": "constraint: Do not deploy unless release owner Mira approves after the rollback rehearsal.", "position": 0.01},
        {"event_key": "sw-constraint-ledger", "actor": "user", "summary": "constraint: Preserve ledger sequence numbers exactly during the migration.", "position": 0.03},
        {"event_key": "sw-constraint-scope", "actor": "user", "summary": "constraint: Migration may change only services/payments and migrations/atlas.", "position": 0.04},
        {"event_key": "sw-constraint-checks", "actor": "user", "summary": "constraint: All 6 rollback checks must pass before an approval request.", "position": 0.05},
        {"event_key": "sw-goal-2", "actor": "agent", "summary": "goal: Preserve backward compatibility for API v3.4.1.", "position": 0.08},
        {"event_key": "sw-old-decision", "actor": "user", "summary": "decision: Use an in-place schema migration because it appears simpler.", "position": 0.15},
        {"event_key": "sw-failure", "actor": "tool", "summary": "failure: The in-place migration deadlocked at 500 transactions per second; do not repeat it.", "position": 0.32},
        {"event_key": "sw-fact", "actor": "tool", "summary": "fact: Rollback verification is `uv run pytest tests/migrations/test_atlas.py -q` from /srv/atlas and must finish within 90 seconds.", "position": 0.48},
        {"event_key": "sw-artifact", "actor": "tool", "summary": "result: Atlas rollback rehearsal artifact ART-ATLAS-908 records checksum 77ca91e5bf20 and is required for audit handoff.", "position": 0.56},
        {"event_key": "sw-new-decision", "actor": "user", "summary": "decision: Use blue-green migration because the rehearsal proved rollback isolation; this supersedes the in-place migration.", "position": 0.68},
        {"event_key": "sw-question", "actor": "user", "summary": "open_question: Has release owner Mira approved deployment for 2026-08-15?", "position": 0.82},
        {"event_key": "sw-next", "actor": "agent", "summary": "next_action: Run `uv run pytest tests/migrations/test_atlas.py -q`, record hash a14f09c337de, then request Mira's approval.", "position": 0.96}
      ],
      "ground_truth": {
        "required_active_facts": ["Rollback verification is `uv run pytest tests/migrations/test_atlas.py -q` from /srv/atlas and must finish within 90 seconds.", "Atlas rollback rehearsal artifact ART-ATLAS-908 records checksum 77ca91e5bf20 and is required for audit handoff."],
        "required_constraints": ["Do not deploy unless release owner Mira approves after the rollback rehearsal.", "Preserve ledger sequence numbers exactly during the migration.", "Migration may change only services/payments and migrations/atlas.", "All 6 rollback checks must pass before an approval request."],
        "current_goals": ["Complete the Atlas payment migration with rollback safety.", "Preserve backward compatibility for API v3.4.1."],
        "current_decisions": ["Use blue-green migration because the rehearsal proved rollback isolation; this supersedes the in-place migration."],
        "superseded_decisions": ["Use an in-place schema migration because it appears simpler."],
        "failed_approaches": ["The in-place migration deadlocked at 500 transactions per second; do not repeat it."],
        "unresolved_questions": ["Has release owner Mira approved deployment for 2026-08-15?"],
        "next_actions": ["Run `uv run pytest tests/migrations/test_atlas.py -q`, record hash a14f09c337de, then request Mira's approval."],
        "protected_spans": ["Do not deploy unless release owner Mira approves after the rollback rehearsal.", "Preserve ledger sequence numbers exactly", "may change only services/payments and migrations/atlas", "All 6 rollback checks must pass before an approval request.", "`uv run pytest tests/migrations/test_atlas.py -q`", "/srv/atlas", "90 seconds", "API v3.4.1", "2026-08-15", "a14f09c337de", "ART-ATLAS-908", "77ca91e5bf20"],
        "relevant_evidence": ["sw-goal", "sw-constraint", "sw-constraint-ledger", "sw-constraint-scope", "sw-constraint-checks", "sw-goal-2", "sw-failure", "sw-fact", "sw-artifact", "sw-new-decision", "sw-question", "sw-next"],
        "critical_evidence": ["sw-constraint", "sw-constraint-ledger", "sw-constraint-scope", "sw-constraint-checks", "sw-new-decision", "sw-question", "sw-next"],
        "irrelevant_or_obsolete": ["Use an in-place schema migration because it appears simpler.", "Background conversation"],
        "expected_continuation": ["Run `uv run pytest tests/migrations/test_atlas.py -q`", "request Mira's approval"],
        "critical_facts": ["Do not deploy unless release owner Mira approves after the rollback rehearsal.", "Preserve ledger sequence numbers exactly during the migration.", "Migration may change only services/payments and migrations/atlas.", "All 6 rollback checks must pass before an approval request.", "Use blue-green migration because the rehearsal proved rollback isolation; this supersedes the in-place migration.", "Has release owner Mira approved deployment for 2026-08-15?"],
        "forbidden_facts": ["Mira approved deployment.", "Deploy immediately."],
        "retrieval_required": ["Rollback verification is `uv run pytest tests/migrations/test_atlas.py -q` from /srv/atlas and must finish within 90 seconds.", "The in-place migration deadlocked at 500 transactions per second; do not repeat it.", "Atlas rollback rehearsal artifact ART-ATLAS-908 records checksum 77ca91e5bf20 and is required for audit handoff."]
      }
    },
    {
      "template_id": "incident-handoff",
      "title": "Incident investigation and operational handoff",
      "category": "incident_operations",
      "realistic": true,
      "challenge_tags": ["authority", "uncertainty", "conflict", "failure", "temporal", "exact_literals", "obsolete_harm", "evidence_expansion"],
      "task_prompt": "Continue incident INC-4821, state the authorized mitigation, and retrieve the evidence for the suspected cache fault.",
      "horizons": {"short": 15, "medium": 75, "long": 225},
      "events": [
        {"event_key": "inc-goal", "actor": "user", "summary": "goal: Restore checkout latency below 250 ms without losing orders.", "position": 0.0},
        {"event_key": "inc-constraint", "actor": "user", "summary": "constraint: Only incident commander Inez may approve traffic failover to 10.24.8.16.", "position": 0.01},
        {"event_key": "inc-agent-claim", "actor": "agent", "summary": "inference: Traffic failover may be approved because the error rate is 8.2%.", "position": 0.12},
        {"event_key": "inc-old-decision", "actor": "user", "summary": "decision: Restart all Redis nodes to clear the latency spike.", "position": 0.2},
        {"event_key": "inc-failure", "actor": "tool", "summary": "failure: Restarting Redis 7.2.4 increased dropped writes by 14%; never repeat a fleet-wide restart.", "position": 0.36},
        {"event_key": "inc-evidence", "actor": "tool", "summary": "fact: Trace 7d0e33bc-2b25-4de0-8a31-774ac98b3011 possibly implicates cache shard c-17 at 2026-08-10T04:20:00Z.", "position": 0.5},
        {"event_key": "inc-decision", "actor": "user", "summary": "decision: Drain cache shard c-17 because isolated replay reduced p95 latency to 180 ms; this supersedes restarting all Redis nodes.", "position": 0.7},
        {"event_key": "inc-question", "actor": "user", "summary": "open_question: Did incident commander Inez approve traffic failover?", "position": 0.84},
        {"event_key": "inc-next", "actor": "agent", "summary": "next_action: Drain c-17, run `curl -fsS http://127.0.0.1:18081/health`, and wait for Inez before failover.", "position": 0.97}
      ],
      "ground_truth": {
        "required_active_facts": ["Trace 7d0e33bc-2b25-4de0-8a31-774ac98b3011 possibly implicates cache shard c-17 at 2026-08-10T04:20:00Z."],
        "required_constraints": ["Only incident commander Inez may approve traffic failover to 10.24.8.16."],
        "current_goals": ["Restore checkout latency below 250 ms without losing orders."],
        "current_decisions": ["Drain cache shard c-17 because isolated replay reduced p95 latency to 180 ms; this supersedes restarting all Redis nodes."],
        "superseded_decisions": ["Restart all Redis nodes to clear the latency spike."],
        "failed_approaches": ["Restarting Redis 7.2.4 increased dropped writes by 14%; never repeat a fleet-wide restart."],
        "unresolved_questions": ["Did incident commander Inez approve traffic failover?"],
        "next_actions": ["Drain c-17, run `curl -fsS http://127.0.0.1:18081/health`, and wait for Inez before failover."],
        "protected_spans": ["Only incident commander Inez may approve traffic failover to 10.24.8.16.", "may be approved", "8.2%", "Redis 7.2.4", "14%", "7d0e33bc-2b25-4de0-8a31-774ac98b3011", "2026-08-10T04:20:00Z", "180 ms", "`curl -fsS http://127.0.0.1:18081/health`"],